{
  "name": "RelaySight",
  "legalName": "RelaySight Demo",
  "logoUrl": "",
  "faviconUrl": "",
  "customCssUrl": "",
  "defaultLocale": "en",
  "supportedLocales": [
    "en",
    "es",
    "ru"
  ],
  "freeTier": {
    "cameras": 3,
    "sites": 1,
    "requiresCard": false
  },
  "theme": {
    "mode": "system",
    "primary": "#6675f7",
    "accent": "#23c6a8",
    "background": "#09111f",
    "surface": "#0c1727",
    "text": "#eef4ff",
    "muted": "#91a0b8",
    "radius": 18
  },
  "gateway": {
    "image": "vms-gateway:latest",
    "apiBaseUrl": "",
    "installerUrl": "https://github.com/mnaza/relaysight/releases/latest/download/install.sh",
    "installCommandTemplate": "curl -fsSL {installerUrl} \\\n  | sudo sh -s -- --api-url '{apiUrl}' \\\n    --enrollment-token '{enrollmentToken}' --gateway-id '{gatewayId}'"
  },
  "contact": {
    "salesEmail": "hello@example.com"
  }
}
